{"$schema":"https://json-schema.org/draft/2020-12/schema","$id":"urn:zmachine-if-remix:policy:0.2.0","title":"Proposed normalized remix policy v0.2","description":"Documentation contract only. Does not validate source authenticity, semantics, scope membership, capabilities, approvals, uniqueness by ID, or source-span bounds. Initial world patches are separate.","type":"object","additionalProperties":false,"properties":{"schema_version":{"const":"0.2.0"},"policy_id":{"type":"string","minLength":1,"maxLength":256},"revision":{"type":"integer","minimum":1},"story_sha256":{"type":"string","pattern":"^[0-9a-f]{64}$"},"sources":{"type":"array","items":{"$ref":"#/$defs/source"},"minItems":1,"maxItems":256},"defaults":{"$ref":"#/$defs/defaults"},"generation_rules":{"type":"array","items":{"$ref":"#/$defs/generationRule"},"minItems":0,"maxItems":256},"invariants":{"type":"array","items":{"$ref":"#/$defs/invariant"},"minItems":0,"maxItems":256},"preferences":{"type":"array","items":{"$ref":"#/$defs/preference"},"minItems":0,"maxItems":256}},"required":["schema_version","policy_id","revision","story_sha256","sources","defaults","generation_rules","invariants","preferences"],"$defs":{"source":{"type":"object","additionalProperties":false,"properties":{"id":{"type":"string","minLength":1,"maxLength":256},"origin":{"enum":["initial","editor"]},"text":{"type":"string","minLength":1,"maxLength":32000}},"required":["id","origin","text"]},"sourceSpan":{"type":"object","additionalProperties":false,"properties":{"source_id":{"type":"string","minLength":1,"maxLength":256},"start":{"type":"integer","minimum":0},"end":{"type":"integer","minimum":1}},"required":["source_id","start","end"]},"scope":{"type":"object","additionalProperties":false,"properties":{"origins":{"type":"array","items":{"enum":["native","remix"]},"minItems":1,"maxItems":2,"uniqueItems":true},"entity_ids":{"type":"array","items":{"type":"string","minLength":1,"maxLength":256},"minItems":0,"maxItems":256,"uniqueItems":true},"region_ids":{"type":"array","items":{"type":"string","minLength":1,"maxLength":256},"minItems":0,"maxItems":256,"uniqueItems":true},"domains":{"type":"array","items":{"enum":["topology","identity","characterization","dialogue","inventory","progression","presentation"]},"minItems":1,"maxItems":7,"uniqueItems":true}},"required":["origins","entity_ids","region_ids","domains"]},"defaults":{"type":"object","additionalProperties":false,"properties":{"fidelity":{"const":"preserve_authored_behavior"},"play_semantics":{"const":"attempt"},"unlisted_generation":{"const":"deny"},"unknown_facts":{"const":"unresolved"},"implicit_retcons":{"const":false},"editor_time":{"const":"no_game_time"}},"required":["fidelity","play_semantics","unlisted_generation","unknown_facts","implicit_retcons","editor_time"]},"generationRule":{"type":"object","additionalProperties":false,"properties":{"id":{"type":"string","minLength":1,"maxLength":256},"source":{"$ref":"#/$defs/sourceSpan"},"scope":{"$ref":"#/$defs/scope"},"action":{"enum":["generate.location","generate.character","generate.item","generate.connection","generate.rule","dialogue.adapt","presentation.embellish"]},"triggers":{"type":"array","items":{"enum":["player_attempt","autonomous_event"]},"minItems":1,"maxItems":2,"uniqueItems":true},"decision":{"enum":["allow","deny"]},"supersedes":{"type":"array","items":{"type":"string","minLength":1,"maxLength":256},"minItems":0,"maxItems":256,"uniqueItems":true}},"required":["id","source","scope","action","triggers","decision","supersedes"]},"guard":{"type":"object","additionalProperties":false,"properties":{"id":{"type":"string","minLength":1,"maxLength":256},"enforcement":{"enum":["structural","adapter","semantic"]},"parameters":{"type":"object","maxProperties":32,"additionalProperties":{"oneOf":[{"type":"string","maxLength":2048},{"type":"number"},{"type":"boolean"},{"type":"null"},{"type":"array","items":{"type":["string","number","boolean","null"]},"minItems":0,"maxItems":128}]}}},"required":["id","enforcement","parameters"]},"invariant":{"type":"object","additionalProperties":false,"properties":{"id":{"type":"string","minLength":1,"maxLength":256},"source":{"$ref":"#/$defs/sourceSpan"},"scope":{"$ref":"#/$defs/scope"},"guard":{"$ref":"#/$defs/guard"},"protected":{"type":"boolean"},"supersedes":{"type":"array","items":{"type":"string","minLength":1,"maxLength":256},"minItems":0,"maxItems":256,"uniqueItems":true}},"required":["id","source","scope","guard","protected","supersedes"]},"preference":{"type":"object","additionalProperties":false,"properties":{"id":{"type":"string","minLength":1,"maxLength":256},"source":{"$ref":"#/$defs/sourceSpan"},"text":{"type":"string","minLength":1,"maxLength":2000}},"required":["id","source","text"]}}}
