{"schema_version":"0.2.0","policy_id":"policy:synthetic-example","revision":1,"story_sha256":"aaaaaaaaaaaaaaaaaaaaaaaaaaaaaaaaaaaaaaaaaaaaaaaaaaaaaaaaaaaaaaaa","sources":[{"id":"initial-1","origin":"initial","text":"Preserve original puzzle behavior. Allow new locations and characters when I explore the approved exterior region. Let existing characters respond naturally, but keep their established personalities. Do not invent content elsewhere. Keep descriptions concise."}],"defaults":{"fidelity":"preserve_authored_behavior","play_semantics":"attempt","unlisted_generation":"deny","unknown_facts":"unresolved","implicit_retcons":false,"editor_time":"no_game_time"},"generation_rules":[{"id":"g-locations","source":{"source_id":"initial-1","start":35,"end":114},"scope":{"origins":["remix"],"entity_ids":[],"region_ids":["remix:fixture-exterior"],"domains":["topology"]},"action":"generate.location","triggers":["player_attempt"],"decision":"allow","supersedes":[]},{"id":"g-characters","source":{"source_id":"initial-1","start":35,"end":114},"scope":{"origins":["remix"],"entity_ids":[],"region_ids":["remix:fixture-exterior"],"domains":["identity","characterization","dialogue"]},"action":"generate.character","triggers":["player_attempt"],"decision":"allow","supersedes":[]},{"id":"g-connections","source":{"source_id":"initial-1","start":35,"end":114},"scope":{"origins":["remix"],"entity_ids":[],"region_ids":["remix:fixture-exterior"],"domains":["topology"]},"action":"generate.connection","triggers":["player_attempt"],"decision":"allow","supersedes":[]},{"id":"g-adaptive-dialogue","source":{"source_id":"initial-1","start":115,"end":199},"scope":{"origins":["native"],"entity_ids":[],"region_ids":[],"domains":["dialogue"]},"action":"dialogue.adapt","triggers":["player_attempt"],"decision":"allow","supersedes":[]}],"invariants":[{"id":"i-puzzles","source":{"source_id":"initial-1","start":0,"end":34},"scope":{"origins":["native"],"entity_ids":[],"region_ids":[],"domains":["progression","topology"]},"guard":{"id":"authored.puzzle_behavior","enforcement":"adapter","parameters":{}},"protected":true,"supersedes":[]},{"id":"i-characterization","source":{"source_id":"initial-1","start":115,"end":199},"scope":{"origins":["native"],"entity_ids":[],"region_ids":[],"domains":["characterization","dialogue"]},"guard":{"id":"character.personality_consistency","enforcement":"semantic","parameters":{}},"protected":true,"supersedes":[]}],"preferences":[{"id":"p-concise","source":{"source_id":"initial-1","start":233,"end":259},"text":"Keep descriptions concise."}]}
